{
  "schema": "aerovia.catalog/v1",
  "createdAt": "2026-09-10T01:48:50Z",
  "sourceSha256": "205668688c71f57d4b357da8572c3fc0f45dc2ba4c3d0a1ecccd4453d7da13e5",
  "cases": [
    {
      "network": {
        "schema": "aerovia.network/v1",
        "id": "room-pillar",
        "name": {
          "en": "Room-and-pillar district",
          "es": "Distrito de cámaras y pilares"
        },
        "description": {
          "en": "An interconnected five-by-five roadway grid contains six regulated cross-passages. Low-resistance short circuits can starve the far production strip.",
          "es": "Una malla de cinco por cinco galerías tiene seis cruces regulados. Los cortocircuitos de baja resistencia pueden reducir el caudal de la franja productiva lejana."
        },
        "provenance": {
          "kind": "authored",
          "source": "Aerovia authored engineering case library; reproducible with scripts/pipeline.py create",
          "license": "Apache-2.0"
        },
        "nodes": [
          {
            "id": "atmosphere-in",
            "x": -170,
            "y": -140,
            "z": 0,
            "boundary": 0
          },
          {
            "id": "atmosphere-out",
            "x": 850,
            "y": 720,
            "z": 0,
            "boundary": 0
          },
          {
            "id": "r0c0",
            "x": 0,
            "y": 0,
            "z": -180
          },
          {
            "id": "r0c1",
            "x": 160,
            "y": 0,
            "z": -182
          },
          {
            "id": "r0c2",
            "x": 320,
            "y": 0,
            "z": -184
          },
          {
            "id": "r0c3",
            "x": 480,
            "y": 0,
            "z": -186
          },
          {
            "id": "r0c4",
            "x": 640,
            "y": 0,
            "z": -188
          },
          {
            "id": "r1c0",
            "x": 0,
            "y": 145,
            "z": -183
          },
          {
            "id": "r1c1",
            "x": 160,
            "y": 145,
            "z": -185
          },
          {
            "id": "r1c2",
            "x": 320,
            "y": 145,
            "z": -187
          },
          {
            "id": "r1c3",
            "x": 480,
            "y": 145,
            "z": -189
          },
          {
            "id": "r1c4",
            "x": 640,
            "y": 145,
            "z": -191
          },
          {
            "id": "r2c0",
            "x": 0,
            "y": 290,
            "z": -186
          },
          {
            "id": "r2c1",
            "x": 160,
            "y": 290,
            "z": -188
          },
          {
            "id": "r2c2",
            "x": 320,
            "y": 290,
            "z": -190
          },
          {
            "id": "r2c3",
            "x": 480,
            "y": 290,
            "z": -192
          },
          {
            "id": "r2c4",
            "x": 640,
            "y": 290,
            "z": -194
          },
          {
            "id": "r3c0",
            "x": 0,
            "y": 435,
            "z": -189
          },
          {
            "id": "r3c1",
            "x": 160,
            "y": 435,
            "z": -191
          },
          {
            "id": "r3c2",
            "x": 320,
            "y": 435,
            "z": -193
          },
          {
            "id": "r3c3",
            "x": 480,
            "y": 435,
            "z": -195
          },
          {
            "id": "r3c4",
            "x": 640,
            "y": 435,
            "z": -197
          },
          {
            "id": "r4c0",
            "x": 0,
            "y": 580,
            "z": -192
          },
          {
            "id": "r4c1",
            "x": 160,
            "y": 580,
            "z": -194
          },
          {
            "id": "r4c2",
            "x": 320,
            "y": 580,
            "z": -196
          },
          {
            "id": "r4c3",
            "x": 480,
            "y": 580,
            "z": -198
          },
          {
            "id": "r4c4",
            "x": 640,
            "y": 580,
            "z": -200
          }
        ],
        "edges": [
          {
            "id": "decline-intake",
            "from": "atmosphere-in",
            "to": "r0c0",
            "kind": "intake",
            "name": {
              "en": "Decline Intake",
              "es": "Rampa de admisión"
            },
            "resistance": 0.045,
            "area": 32,
            "target": 0,
            "level": 0
          },
          {
            "id": "district-fan",
            "from": "r4c4",
            "to": "atmosphere-out",
            "kind": "fan",
            "name": {
              "en": "District Fan",
              "es": "Ventilador del distrito"
            },
            "resistance": 0.03,
            "area": 32,
            "target": 0,
            "level": 0,
            "fan": {
              "pressure": 2700,
              "coefficient": 0.012,
              "efficiency": 0.79
            }
          },
          {
            "id": "east-0-0",
            "from": "r0c0",
            "to": "r0c1",
            "kind": "intake",
            "name": {
              "en": "East 0 0",
              "es": "Galería este · fila 1 · tramo 1"
            },
            "resistance": 0.12,
            "area": 18,
            "target": 0,
            "level": 0
          },
          {
            "id": "north-0-0",
            "from": "r0c0",
            "to": "r1c0",
            "kind": "return",
            "name": {
              "en": "North 0 0",
              "es": "Cruce norte · fila 1 · columna 1"
            },
            "resistance": 0.16,
            "area": 20,
            "target": 0,
            "level": 0
          },
          {
            "id": "east-0-1",
            "from": "r0c1",
            "to": "r0c2",
            "kind": "intake",
            "name": {
              "en": "East 0 1",
              "es": "Galería este · fila 1 · tramo 2"
            },
            "resistance": 0.12,
            "area": 18,
            "target": 0,
            "level": 0
          },
          {
            "id": "north-0-1",
            "from": "r0c1",
            "to": "r1c1",
            "kind": "crosscut",
            "name": {
              "en": "North 0 1",
              "es": "Cruce norte · fila 1 · columna 2"
            },
            "resistance": 9,
            "area": 15,
            "target": 0,
            "level": 0
          },
          {
            "id": "east-0-2",
            "from": "r0c2",
            "to": "r0c3",
            "kind": "intake",
            "name": {
              "en": "East 0 2",
              "es": "Galería este · fila 1 · tramo 3"
            },
            "resistance": 0.12,
            "area": 18,
            "target": 0,
            "level": 0
          },
          {
            "id": "north-0-2",
            "from": "r0c2",
            "to": "r1c2",
            "kind": "crosscut",
            "name": {
              "en": "North 0 2",
              "es": "Cruce norte · fila 1 · columna 3"
            },
            "resistance": 9,
            "area": 15,
            "target": 0,
            "level": 0
          },
          {
            "id": "east-0-3",
            "from": "r0c3",
            "to": "r0c4",
            "kind": "intake",
            "name": {
              "en": "East 0 3",
              "es": "Galería este · fila 1 · tramo 4"
            },
            "resistance": 0.12,
            "area": 18,
            "target": 0,
            "level": 0
          },
          {
            "id": "north-0-3",
            "from": "r0c3",
            "to": "r1c3",
            "kind": "return",
            "name": {
              "en": "North 0 3",
              "es": "Cruce norte · fila 1 · columna 4"
            },
            "resistance": 0.23500000000000001,
            "area": 20,
            "target": 0,
            "level": 0
          },
          {
            "id": "north-0-4",
            "from": "r0c4",
            "to": "r1c4",
            "kind": "return",
            "name": {
              "en": "North 0 4",
              "es": "Cruce norte · fila 1 · columna 5"
            },
            "resistance": 0.26,
            "area": 20,
            "target": 0,
            "level": 0
          },
          {
            "id": "east-1-0",
            "from": "r1c0",
            "to": "r1c1",
            "kind": "intake",
            "name": {
              "en": "East 1 0",
              "es": "Galería este · fila 2 · tramo 1"
            },
            "resistance": 0.16,
            "area": 18,
            "target": 0,
            "level": 0
          },
          {
            "id": "north-1-0",
            "from": "r1c0",
            "to": "r2c0",
            "kind": "return",
            "name": {
              "en": "North 1 0",
              "es": "Cruce norte · fila 2 · columna 1"
            },
            "resistance": 0.16,
            "area": 20,
            "target": 0,
            "level": 0
          },
          {
            "id": "east-1-1",
            "from": "r1c1",
            "to": "r1c2",
            "kind": "intake",
            "name": {
              "en": "East 1 1",
              "es": "Galería este · fila 2 · tramo 2"
            },
            "resistance": 0.16,
            "area": 18,
            "target": 0,
            "level": 0
          },
          {
            "id": "north-1-1",
            "from": "r1c1",
            "to": "r2c1",
            "kind": "crosscut",
            "name": {
              "en": "North 1 1",
              "es": "Cruce norte · fila 2 · columna 2"
            },
            "resistance": 9,
            "area": 15,
            "target": 0,
            "level": 0
          },
          {
            "id": "east-1-2",
            "from": "r1c2",